"DESCRIPTION","DURATION IN MS","NAME","PARENT SUITE","START TIME","STATUS","STOP TIME","SUB SUITE","SUITE","TEST CLASS","TEST METHOD"
"","1914","submit book button is compact on mobile","chromium","2026-05-24","passed","2026-05-24","Home submit book CTA layout","","",""
"","15912","админ меняет вопрос секции — изменение сохраняется после reload и видно на главной","chromium","2026-05-24","passed","2026-05-24","AdminPanel — вкладка «Интро»","","",""
"","1158","на странице нет кнопки переключения темы","chromium","2026-05-24","passed","2026-05-24","тема (dark/light)","","",""
"","5577","валидация: ошибки появляются при отправке пустой формы","chromium","2026-05-24","passed","2026-05-24","","","",""
"","3468","header hides after scrolling down past threshold","chromium","2026-05-24","passed","2026-05-24","Header: hide on scroll down","","",""
"","13440","удалённый пользователь не появляется после перезагрузки страницы","chromium","2026-05-24","passed","2026-05-24","Удаление пользователя в админке","","",""
"","8365","удаление пользователя закрывает drawer и убирает строку","chromium","2026-05-24","passed","2026-05-24","админка — пользователи и фидбеки","","",""
"","7489","[SEC] обычный пользователь не может изменить статус книги","chromium","2026-05-24","passed","2026-05-24","AdminPanel — изменение статуса книги","","",""
"","4537","tag description textarea grows to fit entered text","chromium","2026-05-24","passed","2026-05-24","Admin tab layout states","","",""
"","17364","изменение статуса книги на ""Читаем"" сохраняется после перезагрузки","chromium","2026-05-24","passed","2026-05-24","AdminPanel — изменение статуса книги","","",""
"","3531","filter bar hides together with header on scroll down","chromium","2026-05-24","passed","2026-05-24","Header: hide on scroll down","","",""
"","3641","[SEC] обычный пользователь не может редактировать интро","chromium","2026-05-24","passed","2026-05-24","AdminPanel — вкладка «Интро»","","",""
"","8986","авторизованный: форма закрывается клавишей Escape","chromium","2026-05-24","passed","2026-05-24","","","",""
"","3079","авторизованный не-admin перенаправляется с /admin на главную","chromium","2026-05-24","passed","2026-05-24","панель администратора — доступ","","",""
"","8661","поиск открывает drawer со всеми секциями пользователя","chromium","2026-05-24","passed","2026-05-24","админка — пользователи и фидбеки","","",""
"","3842","header and filters reappear on scroll up","chromium","2026-05-24","passed","2026-05-24","Header: hide on scroll down","","",""
"","10073","приоритеты сохраняются и после reload читаются по bookId","chromium","2026-05-24","passed","2026-05-24","","","",""
"","4648","book sort arrow stays on the same line as header text","chromium","2026-05-24","passed","2026-05-24","Admin tab layout states","","",""
"","4721","ContactsForm не появляется — профиль сохраняется автоматически","chromium","2026-05-24","passed","2026-05-24","Авторизация через Telegram","","",""
"","2271","неавторизованный: клик «Предложить книгу» открывает форму входа","chromium","2026-05-24","passed","2026-05-24","","","",""
"","1145","пустой запрос показывает все книги","chromium","2026-05-24","passed","2026-05-24","поиск по книгам","","",""
"","14792","таблица по книгам сортируется по числу записей и названию","chromium","2026-05-24","passed","2026-05-24","AdminPanel — изменение статуса книги","","",""
"","4743","тост появляется после второй книги","chromium","2026-05-24","passed","2026-05-24","","","",""
"","14551","опциональные поля: форма принимает полностью заполненную заявку","chromium","2026-05-24","passed","2026-05-24","","","",""
"","26278","тост закрывается автоматически через 20 секунд","chromium","2026-05-24","passed","2026-05-24","","","",""
"","11660","снятие записи на книгу сохраняется после reload","chromium","2026-05-24","passed","2026-05-24","админка — пользователи и фидбеки","","",""
"","5294","кнопка «Открыть» закрывает тост и открывает профиль","chromium","2026-05-24","passed","2026-05-24","","","",""
"","3154","обычный пользователь не видит ссылку /admin на главной","chromium","2026-05-24","passed","2026-05-24","панель администратора — доступ","","",""
"","4952","кнопка ✕ закрывает тост","chromium","2026-05-24","passed","2026-05-24","","","",""
"","6069","профиль показывает @username вместо email","chromium","2026-05-24","passed","2026-05-24","Авторизация через Telegram","","",""
"","25644","создание скрытой книги, публикация, скрытие и архив сохраняются после перезагрузки","chromium","2026-05-24","passed","2026-05-24","AdminPanel — вкладка «Каталог»","","",""
"","1368","кириллический запрос возвращает результаты или «Ничего не найдено»","chromium","2026-05-24","passed","2026-05-24","поиск по книгам","","",""
"","1181","поле поиска отображается на странице","chromium","2026-05-24","passed","2026-05-24","поиск по книгам","","",""
"","18144","одобрение заявки автоматически записывает автора на предложенную книгу","chromium","2026-05-24","passed","2026-05-24","","","",""
"","5641","авторизованный: форма закрывается кликом по оверлею","chromium","2026-05-24","passed","2026-05-24","","","",""
"","10163","изменение описания тега ""государство"" отображается в каталоге","chromium","2026-05-24","passed","2026-05-24","Редактирование тега в админке","","",""
"","6317","тост не показывается повторно если флаг уже установлен","chromium","2026-05-24","passed","2026-05-24","","","",""
"","2441","повторный клик возвращает в сетку","chromium","2026-05-24","passed","2026-05-24","переключение вида отображения","","",""
"","1072","html-элемент не имеет класса dark по умолчанию","chromium","2026-05-24","passed","2026-05-24","тема (dark/light)","","",""
"","5589","авторизованный: форма открывается и закрывается крестиком","chromium","2026-05-24","passed","2026-05-24","","","",""
"","47699","hover на тост ставит таймер на паузу","chromium","2026-05-24","passed","2026-05-24","","","",""
"","6533","успешная отправка: форма показывает подтверждение","chromium","2026-05-24","passed","2026-05-24","","","",""
"","5655","авторизованный: форма показывает поля в нужном порядке без темы","chromium","2026-05-24","passed","2026-05-24","","","",""
"","1143","кнопка «Читать далее» присутствует хотя бы на одной карточке","chromium","2026-05-24","passed","2026-05-24","карточка книги — разворачивание описания","","",""
"","8852","языки чтения сохраняются после перезагрузки страницы","chromium","2026-05-24","passed","2026-05-24","ProfileDrawer — редактирование профиля","","",""
"","1391","очистка поиска восстанавливает полный список","chromium","2026-05-24","passed","2026-05-24","поиск по книгам","","",""
"","5776","валидация: ошибки исчезают после заполнения полей","chromium","2026-05-24","passed","2026-05-24","","","",""
"","2171","кнопка переключения вида присутствует","chromium","2026-05-24","passed","2026-05-24","переключение вида отображения","","",""
"","8274","вкладка фидбеков показывает фильтры, поиск и открывает пользователя","chromium","2026-05-24","passed","2026-05-24","админка — пользователи и фидбеки","","",""
"","4282","[SEC] не-админ не может вызвать /api/admin/books","chromium","2026-05-24","passed","2026-05-24","AdminPanel — вкладка «Каталог»","","",""
"","3241","после логина пользователь авторизован — кнопки входа нет","chromium","2026-05-24","passed","2026-05-24","","","",""
"","5601","валидация: ошибка появляется при уходе из обязательного поля","chromium","2026-05-24","passed","2026-05-24","","","",""
"","5886","изменение имени отображается сразу в интерфейсе","chromium","2026-05-24","passed","2026-05-24","ProfileDrawer — редактирование профиля","","",""
"","1667","неавторизованный пользователь перенаправляется с /admin на главную","chromium","2026-05-24","passed","2026-05-24","панель администратора — доступ","","",""
"","4589","кнопка обновляет все виджеты без перезагрузки страницы","chromium","2026-05-24","passed","2026-05-24","админка — виджеты подвала","","",""
"","2521","клик переключает в табличный вид","chromium","2026-05-24","passed","2026-05-24","переключение вида отображения","","",""
"","1526","кнопка входа видна неавторизованному пользователю","chromium","2026-05-24","passed","2026-05-24","","","",""
"","1538","несуществующий запрос показывает «Ничего не найдено»","chromium","2026-05-24","passed","2026-05-24","поиск по книгам","","",""
"","5443","intro body textarea grows to fit entered text","chromium","2026-05-24","passed","2026-05-24","Admin tab layout states","","",""
"","1357","клик на «Читать далее» показывает «Свернуть»","chromium","2026-05-24","passed","2026-05-24","карточка книги — разворачивание описания","","",""
"","1521","клик на «Свернуть» возвращает кнопку «Читать далее»","chromium","2026-05-24","passed","2026-05-24","карточка книги — разворачивание описания","","",""
"","3506","вид восстанавливается после перезагрузки страницы","chromium","2026-05-24","passed","2026-05-24","переключение вида отображения","","",""
"","2292","выбранный вид сохраняется в localStorage","chromium","2026-05-24","passed","2026-05-24","переключение вида отображения","","",""
"","8082","drawer slides in from the right within viewport bounds","chromium","2026-05-24","passed","2026-05-24","Admin user drawer layout","","",""
"","9064","повторный submit заменяет список книг, а не добавляет к старому","chromium","2026-05-24","passed","2026-05-24","","","",""
"","5719","тост не появляется после первой книги","chromium","2026-05-24","passed","2026-05-24","","","",""
"","6596","успешная отправка: кнопка «Закрыть» в success-стейте закрывает диалог","chromium","2026-05-24","passed","2026-05-24","","","",""
"","2256","по умолчанию отображается сетка (grid)","chromium","2026-05-24","passed","2026-05-24","переключение вида отображения","","",""
"","2977","header visible at top of page","chromium","2026-05-24","passed","2026-05-24","Header: hide on scroll down","","",""
"","8238","новый пользователь заполняет профиль и записывается на книгу","chromium","2026-05-24","passed","2026-05-24","","","",""
"","1252","ввод текста фильтрует список книг","chromium","2026-05-24","passed","2026-05-24","поиск по книгам","","",""
