"DESCRIPTION","DURATION IN MS","NAME","PARENT SUITE","START TIME","STATUS","STOP TIME","SUB SUITE","SUITE","TEST CLASS","TEST METHOD"
"","6336","снятие записи на книгу сохраняется после reload","chromium","2026-05-18","passed","2026-05-18","админка — пользователи и фидбеки","","",""
"","760","кнопка «Читать далее» присутствует хотя бы на одной карточке","chromium","2026-05-18","passed","2026-05-18","карточка книги — разворачивание описания","","",""
"","685","html-элемент не имеет класса dark по умолчанию","chromium","2026-05-18","passed","2026-05-18","тема (dark/light)","","",""
"","818","пустой запрос показывает все книги","chromium","2026-05-18","passed","2026-05-18","поиск по книгам","","",""
"","1346","после логина пользователь авторизован — кнопки входа нет","chromium","2026-05-18","passed","2026-05-18","","","",""
"","1198","обычный пользователь не видит ссылку /admin на главной","chromium","2026-05-18","passed","2026-05-18","панель администратора — доступ","","",""
"","1156","несуществующий запрос показывает «Ничего не найдено»","chromium","2026-05-18","passed","2026-05-18","поиск по книгам","","",""
"","2819","авторизованный: форма закрывается клавишей Escape","chromium","2026-05-18","passed","2026-05-18","","","",""
"","3602","успешная отправка: форма показывает подтверждение","chromium","2026-05-18","passed","2026-05-18","","","",""
"","5109","повторный submit заменяет список книг, а не добавляет к старому","chromium","2026-05-18","passed","2026-05-18","","","",""
"","3201","профиль показывает @username вместо email","chromium","2026-05-18","passed","2026-05-18","Авторизация через Telegram","","",""
"","4530","новый пользователь заполняет профиль и записывается на книгу","chromium","2026-05-18","passed","2026-05-18","","","",""
"","856","ввод текста фильтрует список книг","chromium","2026-05-18","passed","2026-05-18","поиск по книгам","","",""
"","2828","валидация: ошибки исчезают после заполнения полей","chromium","2026-05-18","passed","2026-05-18","","","",""
"","4852","drawer slides in from the right within viewport bounds","chromium","2026-05-18","passed","2026-05-18","Admin user drawer layout","","",""
"","986","кнопка входа видна неавторизованному пользователю","chromium","2026-05-18","passed","2026-05-18","","","",""
"","2994","header and filters reappear on scroll up","chromium","2026-05-18","passed","2026-05-18","Header: hide on scroll down","","",""
"","2328","header visible at top of page","chromium","2026-05-18","passed","2026-05-18","Header: hide on scroll down","","",""
"","2684","неавторизованный пользователь перенаправляется с /admin на главную","chromium","2026-05-18","passed","2026-05-18","панель администратора — доступ","","",""
"","1529","клик переключает в табличный вид","chromium","2026-05-18","passed","2026-05-18","переключение вида отображения","","",""
"","3213","опциональные поля: форма принимает полностью заполненную заявку","chromium","2026-05-18","passed","2026-05-18","","","",""
"","1616","повторный клик возвращает в сетку","chromium","2026-05-18","passed","2026-05-18","переключение вида отображения","","",""
"","2296","[SEC] обычный пользователь не может изменить статус книги","chromium","2026-05-18","passed","2026-05-18","AdminPanel — изменение статуса книги","","",""
"","25749","тост закрывается автоматически через 20 секунд","chromium","2026-05-18","passed","2026-05-18","","","",""
"","3401","вид восстанавливается после перезагрузки страницы","chromium","2026-05-18","passed","2026-05-18","переключение вида отображения","","",""
"","700","на странице нет кнопки переключения темы","chromium","2026-05-18","passed","2026-05-18","тема (dark/light)","","",""
"","5064","таблица по книгам сортируется по числу записей и названию","chromium","2026-05-18","passed","2026-05-18","AdminPanel — изменение статуса книги","","",""
"","2249","submit book button is compact on mobile","chromium","2026-05-18","passed","2026-05-18","Home submit book CTA layout","","",""
"","1111","неавторизованный: клик «Предложить книгу» открывает форму входа","chromium","2026-05-18","passed","2026-05-18","","","",""
"","17604","изменение статуса книги на ""Читаем"" сохраняется после перезагрузки","chromium","2026-05-18","passed","2026-05-18","AdminPanel — изменение статуса книги","","",""
"","874","кириллический запрос возвращает результаты или «Ничего не найдено»","chromium","2026-05-18","passed","2026-05-18","поиск по книгам","","",""
"","4289","тост появляется после второй книги","chromium","2026-05-18","passed","2026-05-18","","","",""
"","8268","удалённый пользователь не появляется после перезагрузки страницы","chromium","2026-05-18","passed","2026-05-18","Удаление пользователя в админке","","",""
"","3926","кнопка ✕ закрывает тост","chromium","2026-05-18","passed","2026-05-18","","","",""
"","2594","filter bar hides together with header on scroll down","chromium","2026-05-18","passed","2026-05-18","Header: hide on scroll down","","",""
"","3536","тост не появляется после первой книги","chromium","2026-05-18","passed","2026-05-18","","","",""
"","3717","успешная отправка: кнопка «Закрыть» в success-стейте закрывает диалог","chromium","2026-05-18","passed","2026-05-18","","","",""
"","1553","выбранный вид сохраняется в localStorage","chromium","2026-05-18","passed","2026-05-18","переключение вида отображения","","",""
"","10463","админ меняет вопрос секции — изменение сохраняется после reload и видно на главной","chromium","2026-05-18","passed","2026-05-18","AdminPanel — вкладка «Интро»","","",""
"","4425","кнопка «Открыть» закрывает тост и открывает профиль","chromium","2026-05-18","passed","2026-05-18","","","",""
"","913","клик на «Читать далее» показывает «Свернуть»","chromium","2026-05-18","passed","2026-05-18","карточка книги — разворачивание описания","","",""
"","4143","тост не показывается повторно если флаг уже установлен","chromium","2026-05-18","passed","2026-05-18","","","",""
"","3451","изменение имени отображается сразу в интерфейсе","chromium","2026-05-18","passed","2026-05-18","ProfileDrawer — редактирование профиля","","",""
"","898","очистка поиска восстанавливает полный список","chromium","2026-05-18","passed","2026-05-18","поиск по книгам","","",""
"","46374","hover на тост ставит таймер на паузу","chromium","2026-05-18","passed","2026-05-18","","","",""
"","12342","изменение описания тега ""государство"" отображается в каталоге","chromium","2026-05-18","passed","2026-05-18","Редактирование тега в админке","","",""
"","2618","ContactsForm не появляется — профиль сохраняется автоматически","chromium","2026-05-18","passed","2026-05-18","Авторизация через Telegram","","",""
"","833","[SEC] обычный пользователь не может редактировать интро","chromium","2026-05-18","passed","2026-05-18","AdminPanel — вкладка «Интро»","","",""
"","6336","языки чтения сохраняются после перезагрузки страницы","chromium","2026-05-18","passed","2026-05-18","ProfileDrawer — редактирование профиля","","",""
"","2752","валидация: ошибки появляются при отправке пустой формы","chromium","2026-05-18","passed","2026-05-18","","","",""
"","4422","поиск открывает drawer со всеми секциями пользователя","chromium","2026-05-18","passed","2026-05-18","админка — пользователи и фидбеки","","",""
"","1511","кнопка переключения вида присутствует","chromium","2026-05-18","passed","2026-05-18","переключение вида отображения","","",""
"","1000","клик на «Свернуть» возвращает кнопку «Читать далее»","chromium","2026-05-18","passed","2026-05-18","карточка книги — разворачивание описания","","",""
"","2277","кнопка обновляет все виджеты без перезагрузки страницы","chromium","2026-05-18","passed","2026-05-18","админка — виджеты подвала","","",""
"","4670","вкладка фидбеков показывает фильтры, поиск и открывает пользователя","chromium","2026-05-18","passed","2026-05-18","админка — пользователи и фидбеки","","",""
"","2917","авторизованный: форма закрывается кликом по оверлею","chromium","2026-05-18","passed","2026-05-18","","","",""
"","4031","удаление пользователя закрывает drawer и убирает строку","chromium","2026-05-18","passed","2026-05-18","админка — пользователи и фидбеки","","",""
"","2740","авторизованный: форма показывает поля в нужном порядке без темы","chromium","2026-05-18","passed","2026-05-18","","","",""
"","2760","валидация: ошибка появляется при уходе из обязательного поля","chromium","2026-05-18","passed","2026-05-18","","","",""
"","2824","авторизованный: форма открывается и закрывается крестиком","chromium","2026-05-18","passed","2026-05-18","","","",""
"","1871","по умолчанию отображается сетка (grid)","chromium","2026-05-18","passed","2026-05-18","переключение вида отображения","","",""
"","2627","header hides after scrolling down past threshold","chromium","2026-05-18","passed","2026-05-18","Header: hide on scroll down","","",""
"","1222","авторизованный не-admin перенаправляется с /admin на главную","chromium","2026-05-18","passed","2026-05-18","панель администратора — доступ","","",""
"","752","поле поиска отображается на странице","chromium","2026-05-18","passed","2026-05-18","поиск по книгам","","",""
