"DESCRIPTION","DURATION IN MS","NAME","PARENT SUITE","START TIME","STATUS","STOP TIME","SUB SUITE","SUITE","TEST CLASS","TEST METHOD"
"","2032","кнопка ✕ закрывает тост","chromium","2026-05-19","passed","2026-05-19","","","",""
"","1213","обычный пользователь не видит ссылку /admin на главной","chromium","2026-05-19","passed","2026-05-19","панель администратора — доступ","","",""
"","14151","header and filters reappear on scroll up","chromium","2026-05-19","passed","2026-05-19","Header: hide on scroll down","","",""
"","1572","неавторизованный: клик «Предложить книгу» открывает форму входа","chromium","2026-05-19","passed","2026-05-19","","","",""
"","2066","по умолчанию отображается сетка (grid)","chromium","2026-05-19","passed","2026-05-19","переключение вида отображения","","",""
"","2449","повторный клик возвращает в сетку","chromium","2026-05-19","passed","2026-05-19","переключение вида отображения","","",""
"","6370","снятие записи на книгу сохраняется после reload","chromium","2026-05-19","passed","2026-05-19","админка — пользователи и фидбеки","","",""
"","6295","языки чтения сохраняются после перезагрузки страницы","chromium","2026-05-19","passed","2026-05-19","ProfileDrawer — редактирование профиля","","",""
"","1758","submit book button is compact on mobile","chromium","2026-05-19","passed","2026-05-19","Home submit book CTA layout","","",""
"","2826","авторизованный: форма открывается и закрывается крестиком","chromium","2026-05-19","passed","2026-05-19","","","",""
"","1755","выбранный вид сохраняется в localStorage","chromium","2026-05-19","passed","2026-05-19","переключение вида отображения","","",""
"","2835","валидация: ошибки исчезают после заполнения полей","chromium","2026-05-19","passed","2026-05-19","","","",""
"","3042","авторизованный: форма закрывается кликом по оверлею","chromium","2026-05-19","passed","2026-05-19","","","",""
"","693","[SEC] обычный пользователь не может редактировать интро","chromium","2026-05-19","passed","2026-05-19","AdminPanel — вкладка «Интро»","","",""
"","1834","клик на «Свернуть» возвращает кнопку «Читать далее»","chromium","2026-05-19","passed","2026-05-19","карточка книги — разворачивание описания","","",""
"","2612","авторизованный не-admin перенаправляется с /admin на главную","chromium","2026-05-19","passed","2026-05-19","панель администратора — доступ","","",""
"","10245","админ меняет вопрос секции — изменение сохраняется после reload и видно на главной","chromium","2026-05-19","passed","2026-05-19","AdminPanel — вкладка «Интро»","","",""
"","1362","после логина пользователь авторизован — кнопки входа нет","chromium","2026-05-19","passed","2026-05-19","","","",""
"","1058","поле поиска отображается на странице","chromium","2026-05-19","passed","2026-05-19","поиск по книгам","","",""
"","2858","валидация: ошибка появляется при уходе из обязательного поля","chromium","2026-05-19","passed","2026-05-19","","","",""
"","3217","успешная отправка: кнопка «Закрыть» в success-стейте закрывает диалог","chromium","2026-05-19","passed","2026-05-19","","","",""
"","4606","таблица по книгам сортируется по числу записей и названию","chromium","2026-05-19","passed","2026-05-19","AdminPanel — изменение статуса книги","","",""
"","2060","несуществующий запрос показывает «Ничего не найдено»","chromium","2026-05-19","passed","2026-05-19","поиск по книгам","","",""
"","2229","tag description textarea grows to fit entered text","chromium","2026-05-19","passed","2026-05-19","Admin tab layout states","","",""
"","956","ввод текста фильтрует список книг","chromium","2026-05-19","passed","2026-05-19","поиск по книгам","","",""
"","2765","тост появляется после второй книги","chromium","2026-05-19","passed","2026-05-19","","","",""
"","1748","очистка поиска восстанавливает полный список","chromium","2026-05-19","passed","2026-05-19","поиск по книгам","","",""
"","4268","тост не показывается повторно если флаг уже установлен","chromium","2026-05-19","passed","2026-05-19","","","",""
"","1890","[SEC] обычный пользователь не может изменить статус книги","chromium","2026-05-19","passed","2026-05-19","AdminPanel — изменение статуса книги","","",""
"","16731","изменение описания тега ""государство"" отображается в каталоге","chromium","2026-05-19","passed","2026-05-19","Редактирование тега в админке","","",""
"","1290","на странице нет кнопки переключения темы","chromium","2026-05-19","passed","2026-05-19","тема (dark/light)","","",""
"","1626","кнопка переключения вида присутствует","chromium","2026-05-19","passed","2026-05-19","переключение вида отображения","","",""
"","4656","повторный submit заменяет список книг, а не добавляет к старому","chromium","2026-05-19","passed","2026-05-19","","","",""
"","2117","кнопка обновляет все виджеты без перезагрузки страницы","chromium","2026-05-19","passed","2026-05-19","админка — виджеты подвала","","",""
"","24425","тост закрывается автоматически через 20 секунд","chromium","2026-05-19","passed","2026-05-19","","","",""
"","2607","ContactsForm не появляется — профиль сохраняется автоматически","chromium","2026-05-19","passed","2026-05-19","Авторизация через Telegram","","",""
"","1658","кнопка «Читать далее» присутствует хотя бы на одной карточке","chromium","2026-05-19","passed","2026-05-19","карточка книги — разворачивание описания","","",""
"","44919","hover на тост ставит таймер на паузу","chromium","2026-05-19","passed","2026-05-19","","","",""
"","2399","тост не появляется после первой книги","chromium","2026-05-19","passed","2026-05-19","","","",""
"","8715","одобрение заявки автоматически записывает автора на предложенную книгу","chromium","2026-05-19","passed","2026-05-19","","","",""
"","3889","удаление пользователя закрывает drawer и убирает строку","chromium","2026-05-19","passed","2026-05-19","админка — пользователи и фидбеки","","",""
"","1047","кнопка входа видна неавторизованному пользователю","chromium","2026-05-19","passed","2026-05-19","","","",""
"","3746","успешная отправка: форма показывает подтверждение","chromium","2026-05-19","passed","2026-05-19","","","",""
"","1094","html-элемент не имеет класса dark по умолчанию","chromium","2026-05-19","passed","2026-05-19","тема (dark/light)","","",""
"","3648","вкладка фидбеков показывает фильтры, поиск и открывает пользователя","chromium","2026-05-19","passed","2026-05-19","админка — пользователи и фидбеки","","",""
"","1683","кириллический запрос возвращает результаты или «Ничего не найдено»","chromium","2026-05-19","passed","2026-05-19","поиск по книгам","","",""
"","4045","drawer slides in from the right within viewport bounds","chromium","2026-05-19","passed","2026-05-19","Admin user drawer layout","","",""
"","1719","клик переключает в табличный вид","chromium","2026-05-19","passed","2026-05-19","переключение вида отображения","","",""
"","4245","профиль показывает @username вместо email","chromium","2026-05-19","passed","2026-05-19","Авторизация через Telegram","","",""
"","2783","валидация: ошибки появляются при отправке пустой формы","chromium","2026-05-19","passed","2026-05-19","","","",""
"","4065","filter bar hides together with header on scroll down","chromium","2026-05-19","passed","2026-05-19","Header: hide on scroll down","","",""
"","2798","авторизованный: форма показывает поля в нужном порядке без темы","chromium","2026-05-19","passed","2026-05-19","","","",""
"","994","клик на «Читать далее» показывает «Свернуть»","chromium","2026-05-19","passed","2026-05-19","карточка книги — разворачивание описания","","",""
"","2184","неавторизованный пользователь перенаправляется с /admin на главную","chromium","2026-05-19","passed","2026-05-19","панель администратора — доступ","","",""
"","3490","вид восстанавливается после перезагрузки страницы","chromium","2026-05-19","passed","2026-05-19","переключение вида отображения","","",""
"","19500","изменение статуса книги на ""Читаем"" сохраняется после перезагрузки","chromium","2026-05-19","passed","2026-05-19","AdminPanel — изменение статуса книги","","",""
"","3085","intro body textarea grows to fit entered text","chromium","2026-05-19","passed","2026-05-19","Admin tab layout states","","",""
"","3509","кнопка «Открыть» закрывает тост и открывает профиль","chromium","2026-05-19","passed","2026-05-19","","","",""
"","3972","поиск открывает drawer со всеми секциями пользователя","chromium","2026-05-19","passed","2026-05-19","админка — пользователи и фидбеки","","",""
"","3159","опциональные поля: форма принимает полностью заполненную заявку","chromium","2026-05-19","passed","2026-05-19","","","",""
"","5235","новый пользователь заполняет профиль и записывается на книгу","chromium","2026-05-19","passed","2026-05-19","","","",""
"","2354","book sort arrow stays on the same line as header text","chromium","2026-05-19","passed","2026-05-19","Admin tab layout states","","",""
"","14431","авторизованный: форма закрывается клавишей Escape","chromium","2026-05-19","passed","2026-05-19","","","",""
"","2556","header hides after scrolling down past threshold","chromium","2026-05-19","passed","2026-05-19","Header: hide on scroll down","","",""
"","8051","удалённый пользователь не появляется после перезагрузки страницы","chromium","2026-05-19","passed","2026-05-19","Удаление пользователя в админке","","",""
"","931","пустой запрос показывает все книги","chromium","2026-05-19","passed","2026-05-19","поиск по книгам","","",""
"","2164","header visible at top of page","chromium","2026-05-19","passed","2026-05-19","Header: hide on scroll down","","",""
"","9166","изменение имени отображается сразу в интерфейсе","chromium","2026-05-19","passed","2026-05-19","ProfileDrawer — редактирование профиля","","",""
